{
  "projection_version": "1.0",
  "record_id": "CON-000002",
  "record_type": "concept",
  "title": "Securitization",
  "definition": "[SYNTHETIC] Speech-act framing of issues as existential threats.",
  "status": "extracted",
  "source_ids": [
    "SRC-000002"
  ],
  "layer": "B",
  "evidence_grade": null,
  "relationships": [
    {
      "relationship_id": "REL-000002",
      "predicate": "defines",
      "target_id": "ENT-000003",
      "target_title": "Shanghai Cooperation Organisation",
      "status": "extracted"
    }
  ],
  "provenance": {
    "reviewed": false,
    "review_date": null,
    "block_no": null,
    "origin_table": "ontology_node"
  },
  "sync": {
    "projection_built_ts": "2026-07-16T12:00:00+00:00",
    "projection_version": "1.0"
  }
}