{
  "projection_version": "1.0",
  "record_id": "ENT-000002",
  "record_type": "entity",
  "title": "Central Asia",
  "summary": "[SYNTHETIC] Empirical object — region.",
  "status": "extracted",
  "source_ids": [
    "SRC-000001"
  ],
  "layer": null,
  "evidence_grade": null,
  "relationships": [],
  "provenance": {
    "reviewed": false,
    "review_date": null,
    "block_no": null,
    "origin_table": "ontology_node"
  },
  "sync": {
    "projection_built_ts": "2026-07-16T12:00:00+00:00",
    "projection_version": "1.0"
  }
}