{
  "projection_version": "1.0",
  "record_id": "CON-000001",
  "record_type": "concept",
  "title": "Heartland Theory",
  "definition": "[SYNTHETIC] Pivot-area thesis of Eurasian land power.",
  "status": "extracted",
  "source_ids": [
    "SRC-000001"
  ],
  "layer": "A",
  "evidence_grade": null,
  "relationships": [
    {
      "relationship_id": "REL-000001",
      "predicate": "associated_with",
      "target_id": "ENT-000002",
      "target_title": "Central Asia",
      "status": "extracted"
    }
  ],
  "provenance": {
    "reviewed": false,
    "review_date": null,
    "block_no": null,
    "origin_table": "ontology_node"
  },
  "sync": {
    "projection_built_ts": "2026-07-16T12:00:00+00:00",
    "projection_version": "1.0"
  }
}