{
  "projection_version": "1.0",
  "record_id": "CLM-000001",
  "record_type": "claim",
  "title": "[SYNTHETIC] Land power organises Eurasian security.",
  "detail": "Synthetic claim mapped from claim table.",
  "status": "extracted",
  "source_ids": [
    "SRC-000001"
  ],
  "layer": "A",
  "evidence_grade": "sampled_text_supported_core_candidate",
  "relationships": [
    {
      "relationship_id": "REL-000005",
      "predicate": "supports",
      "target_id": "CON-000001",
      "target_title": "Heartland Theory",
      "status": "extracted"
    }
  ],
  "provenance": {
    "reviewed": false,
    "review_date": null,
    "block_no": null,
    "origin_table": "claim"
  },
  "sync": {
    "projection_built_ts": "2026-07-16T12:00:00+00:00",
    "projection_version": "1.0"
  }
}