{
  "projection_version": "1.0",
  "record_id": "CLM-000004",
  "record_type": "claim",
  "title": "[SYNTHETIC] The SCO securitizes cross-border movement.",
  "detail": "Synthetic claim mapped from claim table.",
  "status": "extracted",
  "source_ids": [
    "SRC-000002"
  ],
  "layer": "B",
  "evidence_grade": null,
  "relationships": [],
  "provenance": {
    "reviewed": false,
    "review_date": null,
    "block_no": null,
    "origin_table": "claim"
  },
  "sync": {
    "projection_built_ts": "2026-07-16T12:00:00+00:00",
    "projection_version": "1.0"
  }
}